{
  "version": 1,
  "request_id": "audit-byderma-grid-rows-preflight-20260907",
  "action": "connector.batch",
  "payload": {
    "operations": [
      {"action": "elementor.inspect", "payload": {"id": 4733}},
      {"action": "post.get", "payload": {"id": 4733}},
      {"action": "elementor.inspect", "payload": {"id": 1216}}
    ]
  },
  "dry_run": true,
  "confirm": false
}
